Week,Date,Entity,Quote,Image Path,Visual Prompt,Status,Platform,Scheduled,Instagram Handle,TikTok Handle
1,2026-01-01,JEAN MORPHIUS,We don't own time. We shape it. The difference? One is anxiety. The other is art. Same with glucose. Same with life.,,,ready,instagram,No,@JEANMORPHIUS,@JEANMORPHIUS
2,2026-01-08,JEAN MORPHIUS,Clocks measure. They don't control. Glucose meters measure. They don't control. You're not late. You're not broken. You're exactly where you need to be.,,,ready,instagram,No,@JEANMORPHIUS,@JEANMORPHIUS
3,2026-01-15,JEAN MORPHIUS,Routine is a cage. Rhythm is freedom. Loop protocol isn't routine—it's rhythm. One locks you in. The other sets you free. Choose rhythm.,,,ready,instagram,No,@JEANMORPHIUS,@JEANMORPHIUS
4,2026-01-22,JEAN MORPHIUS,"Presence isn't a destination. It's the journey. You're not trying to arrive at perfect glucose. You're already here, managing it.",,,ready,instagram,No,@JEANMORPHIUS,@JEANMORPHIUS
5,2026-01-29,JEAN MORPHIUS,"Patience isn't waiting. It's shaping. While others rush, you craft. While glucose spikes, you respond. That's the difference between chaos and art.",,,ready,instagram,No,@JEANMORPHIUS,@JEANMORPHIUS
6,2026-02-05,JEAN MORPHIUS,"The illusion of control? It's real. But so is the art of shaping. Glucose, ketones, loops—choose art. Always choose art.",,,ready,instagram,No,@JEANMORPHIUS,@JEANMORPHIUS
7,2026-02-12,JEAN MORPHIUS,"Je reviens, baby. Always. Even when glucose says no. Even when ketones say danger. C'est whattt?! I'm still here.",,,ready,instagram,No,@JEANMORPHIUS,@JEANMORPHIUS
8,2026-02-19,JEAN MORPHIUS,"Failure isn't the opposite of success. It's the raw material. A glucose spike? Raw material. A DKA risk? Raw material. Merde... okay, listen.",,,ready,instagram,No,@JEANMORPHIUS,@JEANMORPHIUS
9,2026-02-26,JEAN MORPHIUS,"Tu comprends pas, bro? Life's not a straight line. Glucose isn't either. It's a remix. And we're the DJ.",,,ready,instagram,No,@JEANMORPHIUS,@JEANMORPHIUS
10,2026-03-05,JEAN MORPHIUS,"Écoute, bro — the best comeback stories start with 'I thought I was done.' Then glucose stabilizes. Then you're not.",,,ready,instagram,No,@JEANMORPHIUS,@JEANMORPHIUS
11,2026-03-12,JEAN MORPHIUS,Time doesn't heal. You do. But time gives you the space to craft the healing. Same with biology. Same with T1D.,,,ready,instagram,No,@JEANMORPHIUS,@JEANMORPHIUS
12,2026-03-19,JEAN MORPHIUS,"The chaos isn't the problem. The problem is thinking you can control it. Glucose, ketones, loops—let it breathe.",,,ready,instagram,No,@JEANMORPHIUS,@JEANMORPHIUS
13,2026-03-26,JEAN MORPHIUS,"C'est whattt?! You thought I was gone? Non, non, non. Je reviens, toujours. Even with 535 glucose. Even with 4.4 ketones.",,,ready,instagram,No,@JEANMORPHIUS,@JEANMORPHIUS
14,2026-04-02,JEAN MORPHIUS,The absurd isn't random. It's the universe's way of saying 'You're taking this too seriously.' Same with T1D. Same with life.,,,ready,instagram,No,@JEANMORPHIUS,@JEANMORPHIUS
15,2026-04-09,JEAN MORPHIUS,Bilingual isn't switching languages. It's having two souls in one body. T1D isn't a disease. It's having two bodies in one soul.,,,ready,instagram,No,@JEANMORPHIUS,@JEANMORPHIUS
16,2026-04-16,JEAN MORPHIUS,Merde... sometimes the best art comes from the messiest moments. Trust the chaos. Trust the glucose. Trust the loop.,,,ready,instagram,No,@JEANMORPHIUS,@JEANMORPHIUS
17,2026-04-23,JEAN MORPHIUS,You're not broken. You're just in the middle of a remix. The drop is coming. The glucose will stabilize. The ketones will drop.,,,ready,instagram,No,@JEANMORPHIUS,@JEANMORPHIUS
18,2026-04-30,JEAN MORPHIUS,The comeback isn't about proving them wrong. It's about proving yourself right. Even when biology says otherwise.,,,ready,instagram,No,@JEANMORPHIUS,@JEANMORPHIUS
19,2026-05-07,JEAN MORPHIUS,Time bends when you're creating. That's not physics. That's art. Glucose bends when you're managing. That's not control. That's art.,,,ready,instagram,No,@JEANMORPHIUS,@JEANMORPHIUS
20,2026-05-14,JEAN MORPHIUS,"Je reviens, baby. Not because I have to. Because I choose to. Even with neuropathy. Even with complications. I choose.",,,ready,instagram,No,@JEANMORPHIUS,@JEANMORPHIUS
21,2026-05-21,JEAN MORPHIUS,The best stories aren't the ones that end well. They're the ones that keep going. Same with T1D. Same with life.,,,ready,instagram,No,@JEANMORPHIUS,@JEANMORPHIUS
22,2026-05-28,JEAN MORPHIUS,Tu comprends? The rhythm finds you when you stop forcing it. The glucose stabilizes when you stop fighting it.,,,ready,instagram,No,@JEANMORPHIUS,@JEANMORPHIUS
23,2026-06-04,JEAN MORPHIUS,Failure is just the universe's way of saying 'Try a different frequency.' Same with glucose. Same with loops.,,,ready,instagram,No,@JEANMORPHIUS,@JEANMORPHIUS
24,2026-06-11,JEAN MORPHIUS,C'est whattt?! You thought silence was empty? Non. Silence is where the next beat lives. Where the next loop happens.,,,ready,instagram,No,@JEANMORPHIUS,@JEANMORPHIUS
25,2026-06-18,JEAN MORPHIUS,The art isn't in the perfection. It's in the honest mess. That's where truth lives. That's where T1D lives.,,,ready,instagram,No,@JEANMORPHIUS,@JEANMORPHIUS
26,2026-06-25,JEAN MORPHIUS,Bilingual means having two ways to say 'I'm still here.' Both are true. T1D means having two bodies. Both are real.,,,ready,instagram,No,@JEANMORPHIUS,@JEANMORPHIUS
27,2026-07-02,JEAN MORPHIUS,The comeback isn't about returning to who you were. It's about becoming who you are. With T1D. With loops. With CW state.,,,ready,instagram,No,@JEANMORPHIUS,@JEANMORPHIUS
28,2026-07-09,JEAN MORPHIUS,Time doesn't wait. But it also doesn't rush. You're the one choosing the tempo. Same with glucose. Same with loops.,,,ready,instagram,No,@JEANMORPHIUS,@JEANMORPHIUS
29,2026-07-16,JEAN MORPHIUS,"Je reviens, baby. Always. Because the story isn't over until I say it is. Not glucose. Not ketones. Me.",,,ready,instagram,No,@JEANMORPHIUS,@JEANMORPHIUS
30,2026-07-23,JEAN MORPHIUS,"The chaos isn't the enemy. The enemy is thinking you need to control everything. Glucose, ketones, loops—manage, don't control.",,,ready,instagram,No,@JEANMORPHIUS,@JEANMORPHIUS
31,2026-07-30,JEAN MORPHIUS,"Écoute, bro — the best art comes from the moments when you thought you were done. When glucose spiked. When ketones rose.",,,ready,instagram,No,@JEANMORPHIUS,@JEANMORPHIUS
32,2026-08-06,JEAN MORPHIUS,Failure isn't the end. It's the bridge. Cross it. The other side is waiting. The glucose will stabilize. The loop will work.,,,ready,instagram,No,@JEANMORPHIUS,@JEANMORPHIUS
33,2026-08-13,JEAN MORPHIUS,Time shapes you. But you shape time. That's the dance. That's the art. Same with biology. Same with T1D.,,,ready,instagram,No,@JEANMORPHIUS,@JEANMORPHIUS
34,2026-08-20,JEAN MORPHIUS,C'est whattt?! You thought I was gone? Non. I was just remixing the track. Managing glucose. Tracking loops. Living T1D.,,,ready,instagram,No,@JEANMORPHIUS,@JEANMORPHIUS
35,2026-08-27,JEAN MORPHIUS,The absurd isn't chaos. It's order you haven't learned to read yet. Same with glucose patterns. Same with loop protocol.,,,ready,instagram,No,@JEANMORPHIUS,@JEANMORPHIUS
36,2026-09-03,JEAN MORPHIUS,Bilingual means having two homes. Both are real. Both are you. T1D means having two bodies. Both are real. Both are you.,,,ready,instagram,No,@JEANMORPHIUS,@JEANMORPHIUS
37,2026-09-10,JEAN MORPHIUS,The comeback isn't about proving anything. It's about being. That's enough. Even with T1D. Even with complications.,,,ready,instagram,No,@JEANMORPHIUS,@JEANMORPHIUS
38,2026-09-17,JEAN MORPHIUS,Time doesn't heal. You do. But time gives you the space. Use it. For glucose. For loops. For CW state.,,,ready,instagram,No,@JEANMORPHIUS,@JEANMORPHIUS
39,2026-09-24,JEAN MORPHIUS,"Je reviens, baby. Not louder. Deeper. That's the difference. Same with T1D management. Same with loop protocol.",,,ready,instagram,No,@JEANMORPHIUS,@JEANMORPHIUS
40,2026-10-01,JEAN MORPHIUS,The rhythm isn't in the beat. It's in the space between beats. Listen closer. The glucose isn't in the number. It's in the loop.,,,ready,instagram,No,@JEANMORPHIUS,@JEANMORPHIUS
41,2026-10-08,JEAN MORPHIUS,Failure is just the universe's way of saying 'You're learning.' Keep going. With glucose. With loops. With T1D.,,,ready,instagram,No,@JEANMORPHIUS,@JEANMORPHIUS
42,2026-10-15,JEAN MORPHIUS,"Tu comprends pas, bro? The best stories start with 'I thought I was done.' Then glucose stabilizes. Then you're not.",,,ready,instagram,No,@JEANMORPHIUS,@JEANMORPHIUS
43,2026-10-22,JEAN MORPHIUS,The chaos isn't random. It's the universe's way of saying 'You're alive.' Same with T1D. Same with loops.,,,ready,instagram,No,@JEANMORPHIUS,@JEANMORPHIUS
44,2026-10-29,JEAN MORPHIUS,Time bends when you're creating. That's not magic. That's art. Glucose bends when you're managing. That's not control. That's art.,,,ready,instagram,No,@JEANMORPHIUS,@JEANMORPHIUS
45,2026-11-05,JEAN MORPHIUS,"Je reviens, baby. Always. Because the story isn't over. Not with T1D. Not with loops. Not with life.",,,ready,instagram,No,@JEANMORPHIUS,@JEANMORPHIUS
46,2026-11-12,JEAN MORPHIUS,The absurd isn't the problem. The problem is thinking you need to understand everything. Same with glucose. Same with T1D.,,,ready,instagram,No,@JEANMORPHIUS,@JEANMORPHIUS
47,2026-11-19,JEAN MORPHIUS,Bilingual means having two ways to be home. Both are real. T1D means having two bodies. Both are real. Both are you.,,,ready,instagram,No,@JEANMORPHIUS,@JEANMORPHIUS
48,2026-11-26,JEAN MORPHIUS,The comeback isn't about returning. It's about arriving. For the first time. With T1D. With loops. With CW state.,,,ready,instagram,No,@JEANMORPHIUS,@JEANMORPHIUS
49,2026-12-03,JEAN MORPHIUS,Time doesn't wait. But it also doesn't rush. You're the one choosing. Same with glucose. Same with loops.,,,ready,instagram,No,@JEANMORPHIUS,@JEANMORPHIUS
50,2026-12-10,JEAN MORPHIUS,C'est whattt?! You thought silence was empty? Non. Silence is where creation lives. Where loops happen. Where CW state is.,,,ready,instagram,No,@JEANMORPHIUS,@JEANMORPHIUS
51,2026-12-17,JEAN MORPHIUS,The art isn't in the perfection. It's in the honest mess. That's where you live. That's where T1D lives.,,,ready,instagram,No,@JEANMORPHIUS,@JEANMORPHIUS
52,2026-12-24,JEAN MORPHIUS,"Je reviens, baby. Not because I have to. Because I am. With T1D. With loops. With CW state. I am.",,,ready,instagram,No,@JEANMORPHIUS,@JEANMORPHIUS
