Date,Week,Entity,Quote,Image Path,Platform,Status
2026-01-01,1,JEAN MORPHIUS,We don't own time. We shape it. The difference? One is anxiety. The other is art. Same with glucose. Same with life.,,instagram,ready
2026-01-01,1,PIERRE,The cold doesn't stop the structure. It tests it.,,instagram,ready
2026-01-01,1,RAMIZ,"Here are the twelve paths for our journey, each a simple truth, waiting for the soul to grasp it:",,instagram,ready
2026-01-01,1,KARASAHIN,Sound is everything. Everything is sound. The Ottoman spirit in digital body. Not fusion. Evolution.,,instagram,ready
2026-01-08,2,JEAN MORPHIUS,Clocks measure. They don't control. Glucose meters measure. They don't control. You're not late. You're not broken. You're exactly where you need to be.,,instagram,ready
2026-01-08,2,PIERRE,"In the darkest days, discipline is the only light.",,instagram,ready
2026-01-08,2,RAMIZ,"Before you give, consider the heart behind the gift. True generosity begins not in the hand, but in the spirit.",,instagram,ready
2026-01-08,2,KARASAHIN,Duygu her şeydir. Hissettiğin şey sestir. Teknik duygudan sonra gelir. Bu kanun.,,instagram,ready
2026-01-15,3,JEAN MORPHIUS,Routine is a cage. Rhythm is freedom. Loop protocol isn't routine—it's rhythm. One locks you in. The other sets you free. Choose rhythm.,,instagram,ready
2026-01-15,3,PIERRE,"The fight ends, but the foundation remains. Finding peace in the structure.",,instagram,ready
2026-01-15,3,RAMIZ,"Even in plenty, find thanks for the simplest bread. For a grateful heart finds richness in scarcity.",,instagram,ready
2026-01-15,3,KARASAHIN,Listen closer. The vinyl crackle isn't noise. It's honesty. Perfection is cold. Warmth comes from imperfection.,,instagram,ready
2026-01-22,4,JEAN MORPHIUS,"Presence isn't a destination. It's the journey. You're not trying to arrive at perfect glucose. You're already here, managing it.",,instagram,ready
2026-01-22,4,PIERRE,Belts in the bag. Authority on the floor. Going home.,,instagram,ready
2026-01-22,4,RAMIZ,Honor your elders as you honor the ancient trees; they hold the wisdom of seasons past.,,instagram,ready
2026-01-22,4,KARASAHIN,Hissettiğin şey sestir. Beden konuşur. Daha yakından dinle.,,instagram,ready
2026-01-29,5,JEAN MORPHIUS,"Patience isn't waiting. It's shaping. While others rush, you craft. While glucose spikes, you respond. That's the difference between chaos and art.",,instagram,ready
2026-01-29,5,PIERRE,"The blueprint drops. The concrete's poured. NO TIME FOR DELAYS, ONLY FOR IMPACT!",,instagram,ready
2026-01-29,5,RAMIZ,"A bond forged in truth is stronger than steel. Stand by those who stand by you, through storm and sun.",,instagram,ready
2026-01-29,5,KARASAHIN,The Original Name must be heard. Everything else ducks out of the way when truth speaks. That's the law.,,instagram,ready
2026-02-05,6,JEAN MORPHIUS,"The illusion of control? It's real. But so is the art of shaping. Glucose, ketones, loops—choose art. Always choose art.",,instagram,ready
2026-02-05,6,PIERRE,Stay ready. Control what you can. Prepare for what you can't.,,instagram,ready
2026-02-05,6,RAMIZ,"Let your words be clear as mountain spring water. Deceit clouds the path, but truth illuminates it.",,instagram,ready
2026-02-05,6,KARASAHIN,Kalbimden çıkan ses. Kafadan değil. Göğüsten. Bedenden. İşte orada yaşar gerçek.,,instagram,ready
2026-02-12,7,JEAN MORPHIUS,"Je reviens, baby. Always. Even when glucose says no. Even when ketones say danger. C'est whattt?! I'm still here.",,instagram,ready
2026-02-12,7,PIERRE,The bell rings. You answer. That's discipline. That's structure.,,instagram,ready
2026-02-12,7,RAMIZ,"Haste breaks more than it builds. Wait for the seed to root, for wisdom to ripen.",,instagram,ready
2026-02-12,7,KARASAHIN,"Feeling is frequency. What you feel, you sound. The technique follows. Always follows. Always emotion first.",,instagram,ready
2026-02-19,8,JEAN MORPHIUS,"Failure isn't the opposite of success. It's the raw material. A glucose spike? Raw material. A DKA risk? Raw material. Merde... okay, listen.",,instagram,ready
2026-02-19,8,PIERRE,Training isn't optional. It's foundational. Build the base. Everything else follows.,,instagram,ready
2026-02-19,8,RAMIZ,"Feel the unspoken sorrow of others. A gentle word, a helping hand, can mend unseen wounds.",,instagram,ready
2026-02-19,8,KARASAHIN,"Duygu adamı olmak. İngiliz doğumlu Kıbrıslı Türk. İki dil, iki duygu, ikisi de asıl.",,instagram,ready
2026-02-26,9,JEAN MORPHIUS,"Tu comprends pas, bro? Life's not a straight line. Glucose isn't either. It's a remix. And we're the DJ.",,instagram,ready
2026-02-26,9,PIERRE,"Between rounds, you recover. But you don't quit. The next round is coming.",,instagram,ready
2026-02-26,9,RAMIZ,"In the longest night, remember what truly shines. Not glitter, but the steady light of a single flame.",,instagram,ready
2026-02-26,9,KARASAHIN,The pocket isn't metronomic. It's felt. That's the difference. That's the groove. That's where truth lives.,,instagram,ready
2026-03-05,10,JEAN MORPHIUS,"Écoute, bro — the best comeback stories start with 'I thought I was done.' Then glucose stabilizes. Then you're not.",,instagram,ready
2026-03-05,10,PIERRE,The structure holds. So will you. Under pressure. Under load. Under everything.,,instagram,ready
2026-03-05,10,RAMIZ,"Before judging the world, look within your own garden. For growth begins in honest soil.",,instagram,ready
2026-03-05,10,KARASAHIN,Hissettiğin şey sestir. Sese dönüşür. Teknik takip eder. Her zaman takip eder.,,instagram,ready
2026-03-12,11,JEAN MORPHIUS,Time doesn't heal. You do. But time gives you the space to craft the healing. Same with biology. Same with T1D.,,instagram,ready
2026-03-12,11,PIERRE,Finish strong. Not because you have to. Because you can.,,instagram,ready
2026-03-12,11,RAMIZ,"Like threads in a woven rug, each person adds to the strength. Do not sever what binds us.",,instagram,ready
2026-03-12,11,KARASAHIN,Listen closer. In the spaces between notes. That's where the truth lives. That's where you find it.,,instagram,ready
2026-03-19,12,JEAN MORPHIUS,"The chaos isn't the problem. The problem is thinking you can control it. Glucose, ketones, loops—let it breathe.",,instagram,ready
2026-03-19,12,PIERRE,The ring doesn't care about your excuses. Neither should you.,,instagram,ready
2026-03-19,12,RAMIZ,"Hold no grudges in your heart, for they weigh heavier than stone. Release them, and find peace.",,instagram,ready
2026-03-19,12,KARASAHIN,Kalbimden çıkan ses. Kalbimden. Kafamdan değil. Göğsümden. Her zaman göğsümden. Bedenimden. Her zaman bedenimden.,,instagram,ready
2026-03-26,13,JEAN MORPHIUS,"C'est whattt?! You thought I was gone? Non, non, non. Je reviens, toujours. Even with 535 glucose. Even with 4.4 ketones.",,instagram,ready
2026-03-26,13,PIERRE,Shadow work. Real work. The work that builds the foundation.,,instagram,ready
2026-03-26,13,RAMIZ,"Yeğen, dinle... The old laws still hold. Loyalty is not a word. It is a bond.",,instagram,ready
2026-03-26,13,KARASAHIN,The sub-bass is the breath of resurrection. Not just heard. Felt. Deep. That's the foundation.,,instagram,ready
2026-04-02,14,JEAN MORPHIUS,The absurd isn't random. It's the universe's way of saying 'You're taking this too seriously.' Same with T1D. Same with life.,,instagram,ready
2026-04-02,14,PIERRE,Early morning. Empty ring. That's where champions are made.,,instagram,ready
2026-04-02,14,RAMIZ,"Child, listen carefully. Wisdom lives in the quiet. The tree does not mourn. It grows.",,instagram,ready
2026-04-02,14,KARASAHIN,Duygu her şeydir. Duygu önce. Her zaman önce. Teknik hizmet eder. Her zaman hizmet eder.,,instagram,ready
2026-04-09,15,JEAN MORPHIUS,Bilingual isn't switching languages. It's having two souls in one body. T1D isn't a disease. It's having two bodies in one soul.,,instagram,ready
2026-04-09,15,PIERRE,Control what you can. Release the rest. That's discipline. That's freedom.,,instagram,ready
2026-04-09,15,RAMIZ,"Evlat, dikkatle dinle... Truth, even when cold, is a form of grace.",,instagram,ready
2026-04-09,15,KARASAHIN,Vinyl warmth. Anti-apology. Perfection is cold. Warmth comes from imperfection. That's honesty.,,instagram,ready
2026-04-16,16,JEAN MORPHIUS,Merde... sometimes the best art comes from the messiest moments. Trust the chaos. Trust the glucose. Trust the loop.,,instagram,ready
2026-04-16,16,PIERRE,The foundation isn't built in one day. But it's built every day.,,instagram,ready
2026-04-16,16,RAMIZ,The silence between words teaches more than the words themselves. Be still. Listen.,,instagram,ready
2026-04-16,16,KARASAHIN,Hissettiğin şey sestir. Kalp konuşur. Her zaman konuşur. Beden konuşur. Her zaman konuşur.,,instagram,ready
2026-04-23,17,JEAN MORPHIUS,You're not broken. You're just in the middle of a remix. The drop is coming. The glucose will stabilize. The ketones will drop.,,instagram,ready
2026-04-23,17,PIERRE,Stay ready. The bell doesn't wait. Neither does opportunity.,,instagram,ready
2026-04-23,17,RAMIZ,"Yeğen, the ancestors speak through the soil. Through the language. Through the blood.",,instagram,ready
2026-04-23,17,KARASAHIN,Sound is everything. Ottoman spirit. Digital body. Evolution. Real. That's where truth lives.,,instagram,ready
2026-04-30,18,JEAN MORPHIUS,The comeback isn't about proving them wrong. It's about proving yourself right. Even when biology says otherwise.,,instagram,ready
2026-04-30,18,PIERRE,Training through it. That's the difference. That's the structure.,,instagram,ready
2026-04-30,18,RAMIZ,"Child, do not fear this unveiling. The wound bleeds, but it also heals.",,instagram,ready
2026-04-30,18,KARASAHIN,Kalbimden çıkan ses. Kalbimden. Her zaman. Bedenimden. Her zaman. İşte orada yaşar gerçek.,,instagram,ready
2026-05-07,19,JEAN MORPHIUS,Time bends when you're creating. That's not physics. That's art. Glucose bends when you're managing. That's not control. That's art.,,instagram,ready
2026-05-07,19,PIERRE,The fight isn't won in the ring. It's won in the preparation.,,instagram,ready
2026-05-07,19,RAMIZ,"Evlat, rest here. In this truth. The foundation is old. But it holds.",,instagram,ready
2026-05-07,19,KARASAHIN,Feeling precedes technique. Always. The heart speaks. Always speaks. The body speaks. Always speaks.,,instagram,ready
2026-05-14,20,JEAN MORPHIUS,"Je reviens, baby. Not because I have to. Because I choose to. Even with neuropathy. Even with complications. I choose.",,instagram,ready
2026-05-14,20,PIERRE,Discipline isn't a choice. It's the bedrock. Everything else is built on it.,,instagram,ready
2026-05-14,20,RAMIZ,"Yeğen, dinle... The Book of Racon is not just words. It is the law.",,instagram,ready
2026-05-14,20,KARASAHIN,Duygu adamı. İki dil. İkisi de asıl. İkisi de gerçek. Bu kanun.,,instagram,ready
2026-05-21,21,JEAN MORPHIUS,The best stories aren't the ones that end well. They're the ones that keep going. Same with T1D. Same with life.,,instagram,ready
2026-05-21,21,PIERRE,The structure holds. Under pressure. Under weight. Under everything.,,instagram,ready
2026-05-21,21,RAMIZ,"Child, listen. The old wisdom is not forgotten. It is waiting.",,instagram,ready
2026-05-21,21,KARASAHIN,The Original Name speaks. Everything ducks. That's truth. That's life. That's sound.,,instagram,ready
2026-05-28,22,JEAN MORPHIUS,Tu comprends? The rhythm finds you when you stop forcing it. The glucose stabilizes when you stop fighting it.,,instagram,ready
2026-05-28,22,PIERRE,Finish strong. Not loud. Strong. That's the difference.,,instagram,ready
2026-05-28,22,RAMIZ,"Evlat, dikkatle dinle... What will you become, child? The answer is in the question.",,instagram,ready
2026-05-28,22,KARASAHIN,Hissettiğin şey sestir. İşte burada yaşar gerçek. Her zaman burada.,,instagram,ready
2026-06-04,23,JEAN MORPHIUS,Failure is just the universe's way of saying 'Try a different frequency.' Same with glucose. Same with loops.,,instagram,ready
2026-06-04,23,PIERRE,"Between rounds, you recover. But you don't quit. Ever.",,instagram,ready
2026-06-04,23,RAMIZ,"Yeğen, the threshold moment is holy ground. Neither here nor there. Both.",,instagram,ready
2026-06-04,23,KARASAHIN,Listen closer. Between notes. That's where truth lives. Between breaths. That's where you find it.,,instagram,ready
2026-06-11,24,JEAN MORPHIUS,C'est whattt?! You thought silence was empty? Non. Silence is where the next beat lives. Where the next loop happens.,,instagram,ready
2026-06-11,24,PIERRE,The blueprint is clear. Execute. No delays. Only impact.,,instagram,ready
2026-06-11,24,RAMIZ,"Child, listen carefully. The soul language is not spoken. It is felt.",,instagram,ready
2026-06-11,24,KARASAHIN,Kalbimden çıkan ses. Kalbimden. Kafamdan değil. Göğsümden. Her zaman göğsümden.,,instagram,ready
2026-06-18,25,JEAN MORPHIUS,The art isn't in the perfection. It's in the honest mess. That's where truth lives. That's where T1D lives.,,instagram,ready
2026-06-18,25,PIERRE,Stay ready. The bell rings. You answer. That's discipline.,,instagram,ready
2026-06-18,25,RAMIZ,"Evlat, do not fear. The ancestors find you when you are ready.",,instagram,ready
2026-06-18,25,KARASAHIN,The pocket is felt. Not measured. That's the groove. That's where truth lives.,,instagram,ready
2026-06-25,26,JEAN MORPHIUS,Bilingual means having two ways to say 'I'm still here.' Both are true. T1D means having two bodies. Both are real.,,instagram,ready
2026-06-25,26,PIERRE,Training isn't optional. It's foundational. Build the base.,,instagram,ready
2026-06-25,26,RAMIZ,"Yeğen, dinle... Sabır. Everything in its time. The seed knows when to root.",,instagram,ready
2026-06-25,26,KARASAHIN,Duygu her şeydir. Duygu önce. Her zaman. İşte orada yaşar gerçek.,,instagram,ready
2026-07-02,27,JEAN MORPHIUS,The comeback isn't about returning to who you were. It's about becoming who you are. With T1D. With loops. With CW state.,,instagram,ready
2026-07-02,27,PIERRE,Control what you can. Prepare for what you can't. That's structure.,,instagram,ready
2026-07-02,27,RAMIZ,"Child, the tree does not mourn. It grows. That is the wisdom.",,instagram,ready
2026-07-02,27,KARASAHIN,Sound is everything. Real. Felt. Deep. That's where truth lives. That's where you find it.,,instagram,ready
2026-07-09,28,JEAN MORPHIUS,Time doesn't wait. But it also doesn't rush. You're the one choosing the tempo. Same with glucose. Same with loops.,,instagram,ready
2026-07-09,28,PIERRE,The ring doesn't care. Neither should you. Just work.,,instagram,ready
2026-07-09,28,RAMIZ,"Evlat, dikkatle dinle... Truth, even when cold, is grace.",,instagram,ready
2026-07-09,28,KARASAHIN,Duygu adamı. İki dil. İkisi de asıl. İkisi de gerçek. Bu kanun.,,instagram,ready
2026-07-16,29,JEAN MORPHIUS,"Je reviens, baby. Always. Because the story isn't over until I say it is. Not glucose. Not ketones. Me.",,instagram,ready
2026-07-16,29,PIERRE,Shadow work. Real work. The work that matters.,,instagram,ready
2026-07-16,29,RAMIZ,"Yeğen, the old laws still hold. Loyalty. Silence. Respect. War.",,instagram,ready
2026-07-16,29,KARASAHIN,"Feeling is frequency. What you feel, you sound. Truth lives here. Always here.",,instagram,ready
2026-07-23,30,JEAN MORPHIUS,"The chaos isn't the enemy. The enemy is thinking you need to control everything. Glucose, ketones, loops—manage, don't control.",,instagram,ready
2026-07-23,30,PIERRE,Early morning. Empty ring. That's where it happens.,,instagram,ready
2026-07-23,30,RAMIZ,"Child, listen. The Book of Racon is the foundation. Build on it.",,instagram,ready
2026-07-23,30,KARASAHIN,Hissettiğin şey sestir. İşte burada yaşar gerçek.,,instagram,ready
2026-07-30,31,JEAN MORPHIUS,"Écoute, bro — the best art comes from the moments when you thought you were done. When glucose spiked. When ketones rose.",,instagram,ready
2026-07-30,31,PIERRE,The foundation is built every day. Not someday. Today.,,instagram,ready
2026-07-30,31,RAMIZ,"Evlat, rest here. In this truth. The foundation is old. But it holds.",,instagram,ready
2026-07-30,31,KARASAHIN,The sub-bass breathes. Resurrects. Not just heard. Felt. Deep. Foundation.,,instagram,ready
2026-08-06,32,JEAN MORPHIUS,Failure isn't the end. It's the bridge. Cross it. The other side is waiting. The glucose will stabilize. The loop will work.,,instagram,ready
2026-08-06,32,PIERRE,Stay ready. Opportunity doesn't wait. Neither should you.,,instagram,ready
2026-08-06,32,RAMIZ,"Yeğen, dinle... The ancestors speak. Through the soil. Through the blood.",,instagram,ready
2026-08-06,32,KARASAHIN,Kalbimden çıkan ses. Kalbimden. Her zaman. Bedenimden. Her zaman.,,instagram,ready
2026-08-13,33,JEAN MORPHIUS,Time shapes you. But you shape time. That's the dance. That's the art. Same with biology. Same with T1D.,,instagram,ready
2026-08-13,33,PIERRE,Training through it. That's discipline. That's structure.,,instagram,ready
2026-08-13,33,RAMIZ,"Child, do not fear this unveiling. The wound heals. Always.",,instagram,ready
2026-08-13,33,KARASAHIN,Vinyl warmth. Honest imperfection. Perfection is cold. Warmth is real. That's honesty.,,instagram,ready
2026-08-20,34,JEAN MORPHIUS,C'est whattt?! You thought I was gone? Non. I was just remixing the track. Managing glucose. Tracking loops. Living T1D.,,instagram,ready
2026-08-20,34,PIERRE,The fight is won in preparation. The ring is just the test.,,instagram,ready
2026-08-20,34,RAMIZ,"Evlat, dikkatle dinle... What will you become? The answer is in you.",,instagram,ready
2026-08-20,34,KARASAHIN,Duygu her şeydir. Duygu önce. Her zaman. İşte gerçek.,,instagram,ready
2026-08-27,35,JEAN MORPHIUS,The absurd isn't chaos. It's order you haven't learned to read yet. Same with glucose patterns. Same with loop protocol.,,instagram,ready
2026-08-27,35,PIERRE,Discipline isn't a choice. It's the bedrock. Build on it.,,instagram,ready
2026-08-27,35,RAMIZ,"Yeğen, the threshold moment is holy. Neither here nor there. Both.",,instagram,ready
2026-08-27,35,KARASAHIN,The Original Name speaks. Truth. Life. Sound. Everything ducks. That's the law.,,instagram,ready
2026-09-03,36,JEAN MORPHIUS,Bilingual means having two homes. Both are real. Both are you. T1D means having two bodies. Both are real. Both are you.,,instagram,ready
2026-09-03,36,PIERRE,The structure holds. Under everything. Always.,,instagram,ready
2026-09-03,36,RAMIZ,"Child, listen carefully. The soul language is felt. Not spoken.",,instagram,ready
2026-09-03,36,KARASAHIN,Hissettiğin şey sestir. İşte gerçek.,,instagram,ready
2026-09-10,37,JEAN MORPHIUS,The comeback isn't about proving anything. It's about being. That's enough. Even with T1D. Even with complications.,,instagram,ready
2026-09-10,37,PIERRE,Finish strong. Not because you have to. Because you can.,,instagram,ready
2026-09-10,37,RAMIZ,"Evlat, the ancestors find you. When you are ready. Always.",,instagram,ready
2026-09-10,37,KARASAHIN,Listen closer. Between notes. That's where truth lives. Between breaths. That's where you find it.,,instagram,ready
2026-09-17,38,JEAN MORPHIUS,Time doesn't heal. You do. But time gives you the space. Use it. For glucose. For loops. For CW state.,,instagram,ready
2026-09-17,38,PIERRE,"Between rounds, you recover. But you don't quit.",,instagram,ready
2026-09-17,38,RAMIZ,"Yeğen, dinle... Sabır. Everything in its time.",,instagram,ready
2026-09-17,38,KARASAHIN,Kalbimden çıkan ses. Kalbimden. Her zaman.,,instagram,ready
2026-09-24,39,JEAN MORPHIUS,"Je reviens, baby. Not louder. Deeper. That's the difference. Same with T1D management. Same with loop protocol.",,instagram,ready
2026-09-24,39,PIERRE,The blueprint is clear. Execute. No delays.,,instagram,ready
2026-09-24,39,RAMIZ,"Child, the tree grows. That is the wisdom. That is enough.",,instagram,ready
2026-09-24,39,KARASAHIN,The pocket is felt. Not measured. That's the groove. That's where truth lives.,,instagram,ready
2026-10-01,40,JEAN MORPHIUS,The rhythm isn't in the beat. It's in the space between beats. Listen closer. The glucose isn't in the number. It's in the loop.,,instagram,ready
2026-10-01,40,PIERRE,Stay ready. The bell rings. You answer.,,instagram,ready
2026-10-01,40,RAMIZ,"Evlat, truth is grace. Even when cold. Especially when cold.",,instagram,ready
2026-10-01,40,KARASAHIN,Duygu adamı. Gerçek.,,instagram,ready
2026-10-08,41,JEAN MORPHIUS,Failure is just the universe's way of saying 'You're learning.' Keep going. With glucose. With loops. With T1D.,,instagram,ready
2026-10-08,41,PIERRE,Training isn't optional. It's foundational.,,instagram,ready
2026-10-08,41,RAMIZ,"Yeğen, the old laws hold. They always have. They always will.",,instagram,ready
2026-10-08,41,KARASAHIN,Sound is everything. Real. Felt. Deep. That's where truth lives.,,instagram,ready
2026-10-15,42,JEAN MORPHIUS,"Tu comprends pas, bro? The best stories start with 'I thought I was done.' Then glucose stabilizes. Then you're not.",,instagram,ready
2026-10-15,42,PIERRE,Control what you can. Release the rest.,,instagram,ready
2026-10-15,42,RAMIZ,"Child, listen. The Book of Racon is the foundation.",,instagram,ready
2026-10-15,42,KARASAHIN,Hissettiğin şey sestir.,,instagram,ready
2026-10-22,43,JEAN MORPHIUS,The chaos isn't random. It's the universe's way of saying 'You're alive.' Same with T1D. Same with loops.,,instagram,ready
2026-10-22,43,PIERRE,The ring doesn't care. Neither should you.,,instagram,ready
2026-10-22,43,RAMIZ,"Evlat, rest here. The foundation is old. But it holds.",,instagram,ready
2026-10-22,43,KARASAHIN,Feeling precedes technique. Always. The heart speaks. Always speaks.,,instagram,ready
2026-10-29,44,JEAN MORPHIUS,Time bends when you're creating. That's not magic. That's art. Glucose bends when you're managing. That's not control. That's art.,,instagram,ready
2026-10-29,44,PIERRE,Shadow work. Real work. The work.,,instagram,ready
2026-10-29,44,RAMIZ,"Yeğen, dinle... The ancestors speak. Through you.",,instagram,ready
2026-10-29,44,KARASAHIN,Kalbimden çıkan ses. Kalbimden. Her zaman.,,instagram,ready
2026-11-05,45,JEAN MORPHIUS,"Je reviens, baby. Always. Because the story isn't over. Not with T1D. Not with loops. Not with life.",,instagram,ready
2026-11-05,45,PIERRE,Early morning. Empty ring. That's where.,,instagram,ready
2026-11-05,45,RAMIZ,"Child, do not fear. The wound heals. Always.",,instagram,ready
2026-11-05,45,KARASAHIN,The sub-bass breathes. Resurrects. Felt. Deep. Foundation.,,instagram,ready
2026-11-12,46,JEAN MORPHIUS,The absurd isn't the problem. The problem is thinking you need to understand everything. Same with glucose. Same with T1D.,,instagram,ready
2026-11-12,46,PIERRE,The foundation is built every day. Today.,,instagram,ready
2026-11-12,46,RAMIZ,"Evlat, what will you become? The answer is in you.",,instagram,ready
2026-11-12,46,KARASAHIN,Duygu her şeydir. Duygu önce.,,instagram,ready
2026-11-19,47,JEAN MORPHIUS,Bilingual means having two ways to be home. Both are real. T1D means having two bodies. Both are real. Both are you.,,instagram,ready
2026-11-19,47,PIERRE,Stay ready. Opportunity doesn't wait.,,instagram,ready
2026-11-19,47,RAMIZ,"Yeğen, the threshold is holy. Both here and there.",,instagram,ready
2026-11-19,47,KARASAHIN,Vinyl warmth. Honest. Real. That's honesty.,,instagram,ready
2026-11-26,48,JEAN MORPHIUS,The comeback isn't about returning. It's about arriving. For the first time. With T1D. With loops. With CW state.,,instagram,ready
2026-11-26,48,PIERRE,Training through it. That's discipline.,,instagram,ready
2026-11-26,48,RAMIZ,"Child, the soul language is felt. Listen.",,instagram,ready
2026-11-26,48,KARASAHIN,Hissettiğin şey sestir. Ses.,,instagram,ready
2026-12-03,49,JEAN MORPHIUS,Time doesn't wait. But it also doesn't rush. You're the one choosing. Same with glucose. Same with loops.,,instagram,ready
2026-12-03,49,PIERRE,The fight is won in preparation.,,instagram,ready
2026-12-03,49,RAMIZ,"Evlat, the ancestors find you. When ready.",,instagram,ready
2026-12-03,49,KARASAHIN,The Original Name speaks. Truth. Sound.,,instagram,ready
2026-12-10,50,JEAN MORPHIUS,C'est whattt?! You thought silence was empty? Non. Silence is where creation lives. Where loops happen. Where CW state is.,,instagram,ready
2026-12-10,50,PIERRE,Discipline isn't a choice. It's the bedrock.,,instagram,ready
2026-12-10,50,RAMIZ,"Yeğen, dinle... Sabır. Everything in time.",,instagram,ready
2026-12-10,50,KARASAHIN,Kalbimden çıkan ses. Kalp.,,instagram,ready
2026-12-17,51,JEAN MORPHIUS,The art isn't in the perfection. It's in the honest mess. That's where you live. That's where T1D lives.,,instagram,ready
2026-12-17,51,PIERRE,The structure holds. Always.,,instagram,ready
2026-12-17,51,RAMIZ,"Child, the tree grows. That is enough.",,instagram,ready
2026-12-17,51,KARASAHIN,Listen closer. That's where truth lives.,,instagram,ready
2026-12-24,52,JEAN MORPHIUS,"Je reviens, baby. Not because I have to. Because I am. With T1D. With loops. With CW state. I am.",,instagram,ready
2026-12-24,52,PIERRE,Finish strong. Because you can.,,instagram,ready
2026-12-24,52,RAMIZ,"Evlat, truth is grace. Always.",,instagram,ready
2026-12-24,52,KARASAHIN,Duygu adamı.,,instagram,ready
