Week,Date,Entity,Quote,Image Path,Visual Prompt,Status,Platform,Scheduled,Instagram Handle,TikTok Handle
1,2026-01-01,PIERRE,The cold doesn't stop the structure. It tests it.,,,ready,instagram,No,,
2,2026-01-08,PIERRE,"In the darkest days, discipline is the only light.",,,ready,instagram,No,,
3,2026-01-15,PIERRE,"The fight ends, but the foundation remains. Finding peace in the structure.",,,ready,instagram,No,,
4,2026-01-22,PIERRE,Belts in the bag. Authority on the floor. Going home.,,,ready,instagram,No,,
5,2026-01-29,PIERRE,"The blueprint drops. The concrete's poured. NO TIME FOR DELAYS, ONLY FOR IMPACT!",,,ready,instagram,No,,
6,2026-02-05,PIERRE,Stay ready. Control what you can. Prepare for what you can't.,,,ready,instagram,No,,
7,2026-02-12,PIERRE,The bell rings. You answer. That's discipline. That's structure.,,,ready,instagram,No,,
8,2026-02-19,PIERRE,Training isn't optional. It's foundational. Build the base. Everything else follows.,,,ready,instagram,No,,
9,2026-02-26,PIERRE,"Between rounds, you recover. But you don't quit. The next round is coming.",,,ready,instagram,No,,
10,2026-03-05,PIERRE,The structure holds. So will you. Under pressure. Under load. Under everything.,,,ready,instagram,No,,
11,2026-03-12,PIERRE,Finish strong. Not because you have to. Because you can.,,,ready,instagram,No,,
12,2026-03-19,PIERRE,The ring doesn't care about your excuses. Neither should you.,,,ready,instagram,No,,
13,2026-03-26,PIERRE,Shadow work. Real work. The work that builds the foundation.,,,ready,instagram,No,,
14,2026-04-02,PIERRE,Early morning. Empty ring. That's where champions are made.,,,ready,instagram,No,,
15,2026-04-09,PIERRE,Control what you can. Release the rest. That's discipline. That's freedom.,,,ready,instagram,No,,
16,2026-04-16,PIERRE,The foundation isn't built in one day. But it's built every day.,,,ready,instagram,No,,
17,2026-04-23,PIERRE,Stay ready. The bell doesn't wait. Neither does opportunity.,,,ready,instagram,No,,
18,2026-04-30,PIERRE,Training through it. That's the difference. That's the structure.,,,ready,instagram,No,,
19,2026-05-07,PIERRE,The fight isn't won in the ring. It's won in the preparation.,,,ready,instagram,No,,
20,2026-05-14,PIERRE,Discipline isn't a choice. It's the bedrock. Everything else is built on it.,,,ready,instagram,No,,
21,2026-05-21,PIERRE,The structure holds. Under pressure. Under weight. Under everything.,,,ready,instagram,No,,
22,2026-05-28,PIERRE,Finish strong. Not loud. Strong. That's the difference.,,,ready,instagram,No,,
23,2026-06-04,PIERRE,"Between rounds, you recover. But you don't quit. Ever.",,,ready,instagram,No,,
24,2026-06-11,PIERRE,The blueprint is clear. Execute. No delays. Only impact.,,,ready,instagram,No,,
25,2026-06-18,PIERRE,Stay ready. The bell rings. You answer. That's discipline.,,,ready,instagram,No,,
26,2026-06-25,PIERRE,Training isn't optional. It's foundational. Build the base.,,,ready,instagram,No,,
27,2026-07-02,PIERRE,Control what you can. Prepare for what you can't. That's structure.,,,ready,instagram,No,,
28,2026-07-09,PIERRE,The ring doesn't care. Neither should you. Just work.,,,ready,instagram,No,,
29,2026-07-16,PIERRE,Shadow work. Real work. The work that matters.,,,ready,instagram,No,,
30,2026-07-23,PIERRE,Early morning. Empty ring. That's where it happens.,,,ready,instagram,No,,
31,2026-07-30,PIERRE,The foundation is built every day. Not someday. Today.,,,ready,instagram,No,,
32,2026-08-06,PIERRE,Stay ready. Opportunity doesn't wait. Neither should you.,,,ready,instagram,No,,
33,2026-08-13,PIERRE,Training through it. That's discipline. That's structure.,,,ready,instagram,No,,
34,2026-08-20,PIERRE,The fight is won in preparation. The ring is just the test.,,,ready,instagram,No,,
35,2026-08-27,PIERRE,Discipline isn't a choice. It's the bedrock. Build on it.,,,ready,instagram,No,,
36,2026-09-03,PIERRE,The structure holds. Under everything. Always.,,,ready,instagram,No,,
37,2026-09-10,PIERRE,Finish strong. Not because you have to. Because you can.,,,ready,instagram,No,,
38,2026-09-17,PIERRE,"Between rounds, you recover. But you don't quit.",,,ready,instagram,No,,
39,2026-09-24,PIERRE,The blueprint is clear. Execute. No delays.,,,ready,instagram,No,,
40,2026-10-01,PIERRE,Stay ready. The bell rings. You answer.,,,ready,instagram,No,,
41,2026-10-08,PIERRE,Training isn't optional. It's foundational.,,,ready,instagram,No,,
42,2026-10-15,PIERRE,Control what you can. Release the rest.,,,ready,instagram,No,,
43,2026-10-22,PIERRE,The ring doesn't care. Neither should you.,,,ready,instagram,No,,
44,2026-10-29,PIERRE,Shadow work. Real work. The work.,,,ready,instagram,No,,
45,2026-11-05,PIERRE,Early morning. Empty ring. That's where.,,,ready,instagram,No,,
46,2026-11-12,PIERRE,The foundation is built every day. Today.,,,ready,instagram,No,,
47,2026-11-19,PIERRE,Stay ready. Opportunity doesn't wait.,,,ready,instagram,No,,
48,2026-11-26,PIERRE,Training through it. That's discipline.,,,ready,instagram,No,,
49,2026-12-03,PIERRE,The fight is won in preparation.,,,ready,instagram,No,,
50,2026-12-10,PIERRE,Discipline isn't a choice. It's the bedrock.,,,ready,instagram,No,,
51,2026-12-17,PIERRE,The structure holds. Always.,,,ready,instagram,No,,
52,2026-12-24,PIERRE,Finish strong. Because you can.,,,ready,instagram,No,,
